timestamp,speaker,text,source,line
00:00:00,,I'm sorry.,artstream,1435
00:00:00,,Max poked it so well on me.,artstream,1436
00:00:00,,Maxi.,artstream,1437
00:00:00,,"Yes, that wasn't a problem at all.",artstream,1438
00:00:00,,I made it really stupid at the beginning.,artstream,1439
00:00:00,,And somehow I stuck this thesis that you need really bad.,artstream,1440
00:00:00,,Totally...,artstream,1441
00:00:00,,...not really thought out.,artstream,1442
00:00:00,,Somehow.,artstream,1443
00:00:00,,But...,artstream,1444
00:00:00,,...finally it worked out.,artstream,1445
00:00:00,,I have a mosquito net in every room except in the bathroom.,artstream,1446
00:00:00,,Actually.,artstream,1447
00:00:00,,Because I think that the mosquito net gives way worse air.,artstream,1448
00:00:00,,And I just need air in the bathroom.,artstream,1449
00:00:00,,You know?,artstream,1450
00:00:00,,"Kinda makes sense, doesn't it?",artstream,1451
00:00:00,,I'm sorry.,artstream,1452
00:00:00,,"So, okay.",artstream,1453
00:00:00,,I have...,artstream,1454
00:00:00,,The sketch is done.,artstream,1455
00:00:00,,Or not done.,artstream,1456
00:00:00,,I have to edit it because one eye is wrong.,artstream,1457
00:00:00,,This one.,artstream,1458
00:00:00,,Or this one.,artstream,1459
00:00:00,,I have to decide which eye I think is wrong.,artstream,1460
00:00:00,,His nose is somehow a little wider.,artstream,1461
00:00:00,,And a little...,artstream,1462
00:00:00,,But sketches...,artstream,1463
00:00:00,,I can sketch pretty quickly.,artstream,1464
00:00:00,,Or just draw it.,artstream,1465
00:00:00,,I can definitely improve some things with the eraser.,artstream,1466
00:00:00,,I don't like the position of the eye.,artstream,1467
00:00:00,,I have to bring that out a little.,artstream,1468
00:00:00,,But then we know which picture we want to draw next.,artstream,1469
00:00:00,,And that's the final result of today's stream.,artstream,1470
00:00:00,,I don't want to mess up the picture here.,artstream,1471
00:00:00,,For Kai!,artstream,1472
00:00:00,,So.,artstream,1473
00:00:00,,"I used a lot of colors, after all.",artstream,1474
00:00:00,,My brushes.,artstream,1475
00:00:00,,I have to clean that.,artstream,1476
00:00:00,,My 1000 pencils.,artstream,1477
00:00:00,,Yahoo!,artstream,1478
00:00:00,,I have to fix the camera here.,artstream,1479
00:00:00,,Oopsie.,artstream,1480
00:00:00,,I didn't fix it.,artstream,1481
00:00:00,,I'll make it a little darker.,artstream,1482
00:00:00,,So.,artstream,1483
00:00:00,,Hello.,artstream,1484
00:00:00,,So.,artstream,1485
00:00:00,,That was...,artstream,1486
00:00:00,,...not bad at all.,artstream,1487
00:00:00,,Not bad at all.,artstream,1488
00:00:00,,Now a little more light.,artstream,1489
00:00:00,,A little further away.,artstream,1490
00:00:00,,You can also leave it to work.,artstream,1491
00:00:00,,It's a 2020 thing.,artstream,1492
00:00:00,,You're watching the summer party anyway.,artstream,1493
00:00:00,,"Not all of you, but those I see live tomorrow.",artstream,1494
00:00:00,,You can watch it live.,artstream,1495
00:00:00,,It's almost dry.,artstream,1496
00:00:00,,It's just a Looney original.,artstream,1497
00:00:00,,You have to be able to afford it.,artstream,1498
00:00:00,,It cost a lot of money.,artstream,1499
00:00:00,,No.,artstream,1500
00:00:00,,Big shout out to Niklas.,artstream,1501
00:00:00,,That he made the subgoal.,artstream,1502
00:00:00,,We'll do it again next month.,artstream,1503
00:00:00,,I just do a...,artstream,1504
00:00:00,,I just do a...,artstream,1505
00:00:00,,I'll do another subgoal.,artstream,1506
00:00:00,,And then we'll do a 12 hour stream in August.,artstream,1507
00:00:00,,With the painting.,artstream,1508
00:00:00,,We'll do that in August.,artstream,1509
00:00:00,,I just want to...,artstream,1510
00:00:00,,We have this with these discounted shares.,artstream,1511
00:00:00,,I'll do that now.,artstream,1512
00:00:00,,Every month in one of the streams.,artstream,1513
00:00:00,,Then it costs 5...,artstream,1514
00:00:00,,Gifties is somehow 15 euros.,artstream,1515
00:00:00,,You have to go over 12 bridge pictures.,artstream,1516
00:00:00,,The next picture will be a bridge picture.,artstream,1517
00:00:00,,"No, the next picture will be this one.",artstream,1518
00:00:00,,Well.,artstream,1519
00:00:00,,It's art.,artstream,1520
00:00:00,,The perspective is a bit weird.,artstream,1521
00:00:00,,But it's okay.,artstream,1522
00:00:00,,Summer party.,artstream,1523
00:00:00,,I do it every year.,artstream,1524
00:00:00,,At my parents' house.,artstream,1525
00:00:00,,A summer party.,artstream,1526
00:00:00,,With a few people.,artstream,1527
00:00:00,,I don't know if this year will be the last.,artstream,1528
00:00:00,,I talked to my parents today.,artstream,1529
00:00:00,,I usually throw them out.,artstream,1530
00:00:00,,They go on vacation for a few days.,artstream,1531
00:00:00,,While I'm doing party-hardy.,artstream,1532
00:00:00,,"No, it's not a party.",artstream,1533
00:00:00,,But just a get together.,artstream,1534
00:00:00,,It's not my birthday or anything.,artstream,1535
00:00:00,,I don't really want to celebrate my birthday.,artstream,1536
00:00:00,,But just a summer party.,artstream,1537
00:00:00,,Next year it will be here.,artstream,1538
00:00:00,,It can happen here.,artstream,1539
00:00:00,,Depending on how it goes.,artstream,1540
00:00:00,,I will see a lot of you from the chat.,artstream,1541
00:00:00,,I'm really looking forward to it.,artstream,1542
00:00:00,,A lot of people are coming by.,artstream,1543
00:00:00,,My first one!,artstream,1544
00:00:00,,This is the...,artstream,1545
00:00:00,,3rd or 4th summer party in a row.,artstream,1546
00:00:00,,Every year in August there is a party.,artstream,1547
00:00:00,,It's always a little highlight.,artstream,1548
00:00:00,,It's super stressful.,artstream,1549
00:00:00,,But...,artstream,1550
00:00:00,,I'm not invited.,artstream,1551
00:00:00,,I understand.,artstream,1552
00:00:00,,"Yes, I will do a Twitch summer party.",artstream,1553
00:00:00,,In a public place.,artstream,1554
00:00:00,,No.,artstream,1555
00:00:00,,Actually it would be cool.,artstream,1556
00:00:00,,A community party.,artstream,1557
00:00:00,,But it's super hard to implement.,artstream,1558
00:00:00,,And super expensive.,artstream,1559
00:00:00,,"If so, I would rather say we all go out to eat together.",artstream,1560
00:00:00,,When everyone is at the Gamescom.,artstream,1561
00:00:00,,That would be cool.,artstream,1562
00:00:00,,But let's see.,artstream,1563
00:00:00,,Let's see.,artstream,1564
00:00:00,,"Well, I can...",artstream,1565
00:00:00,,I wanted to talk to Zizi about Gamescom.,artstream,1566
00:00:00,,And Sofia might go to Gamescom professionally.,artstream,1567
00:00:00,,I don't know.,artstream,1568
00:00:00,,I don't know.,artstream,1569
00:00:00,,Let's see.,artstream,1570
00:00:00,,Actually I would like to do cosplay.,artstream,1571
00:00:00,,But I don't have time for that.,artstream,1572
00:00:00,,Unfortunately.,artstream,1573
00:00:00,,"Sofia, everything is super spontaneous.",artstream,1574
00:00:00,,No shit.,artstream,1575
00:00:00,,It's so weird.,artstream,1576
00:00:00,,The fans are actually finding my background.,artstream,1577
00:00:00,,I have a sunset lamp here.,artstream,1578
00:00:00,,And somehow it looks super nice on the camera.,artstream,1579
00:00:00,,I only come to Gamescom for the ARD-stand.,artstream,1580
00:00:00,,Huh?,artstream,1581
00:00:00,,"Bush, you're not a Gamescom-gear anyway, right?",artstream,1582
00:00:00,,Very fancy.,artstream,1583
00:00:00,,"Yes, yes.",artstream,1584
00:00:00,,I actually want to do something with my Alexa.,artstream,1585
00:00:00,,So I can go to streaming mode and turn all the lights on.,artstream,1586
00:00:00,,And I ordered this mirror twice.,artstream,1587
00:00:00,,And one of them is completely broken into a thousand pieces.,artstream,1588
00:00:00,,Already arrived.,artstream,1589
00:00:00,,And now I have to send it back.,artstream,1590
00:00:00,,From the line-up.,artstream,1591
00:00:00,,"Yes, okay.",artstream,1592
00:00:00,,I don't know what's coming yet.,artstream,1593
00:00:00,,Actually...,artstream,1594
00:00:00,,"There will be a Witcher 4-stand, right?",artstream,1595
00:00:00,,I don't even have to inform myself.,artstream,1596
00:00:00,,I would like to go with...,artstream,1597
00:00:00,,...with Tom.,artstream,1598
00:00:00,,But we don't have a place to stay.,artstream,1599
00:00:00,,I'll see.,artstream,1600
00:00:00,,So I'll start Discord.,artstream,1601
00:00:00,,It takes...,artstream,1602
00:00:00,,"No Witcher, what the fuck?",artstream,1603
00:00:00,,Dude!,artstream,1604
00:00:00,,"Boy, Kai!",artstream,1605
00:00:00,,That almost scares me.,artstream,1606
00:00:00,,Look at Kai's bib!,artstream,1607
00:00:00,,So...,artstream,1608
00:00:00,,Mine is better.,artstream,1609
00:00:00,,Did you just draw it in paint yourself?,artstream,1610
00:00:00,,Or what's going on here?,artstream,1611
00:00:00,,What's going on here?,artstream,1612
00:00:00,,"Oh my god, oh my god.",artstream,1613
00:00:00,,I zoomed into this picture.,artstream,1614
00:00:00,,That's horrible!,artstream,1615
00:00:00,,"That's very, very bad!",artstream,1616
00:00:00,,Yesterday...,artstream,1617
00:00:00,,You quickly painted it yesterday.,artstream,1618
00:00:00,,I quickly painted it yesterday.,artstream,1619
00:00:00,,Just my inner self.,artstream,1620
00:00:00,,That's what Bibbel's inner self looks like.,artstream,1621
00:00:00,,I'm going to pack some things for tomorrow.,artstream,1622
00:00:00,,"Okay, good night, Ti, sleep well.",artstream,1623
00:00:00,,"No, that's fine.",artstream,1624
00:00:00,,"Those who are already leaving, that's okay.",artstream,1625
00:00:00,,Anyone who can take a blanket with them...,artstream,1626
00:00:00,,"I'm happy to take a blanket with me, because I don't think I have enough.",artstream,1627
00:00:00,,I definitely don't have enough blankets.,artstream,1628
00:00:00,,"Thank you for your follow, nice that you're here.",artstream,1629
00:00:00,,I haven't done a talk stream for a long time.,artstream,1630
00:00:00,,"Well, there was a lot of painting here.",artstream,1631
00:00:00,,"I have to get rid of it now, because I'm afraid it will shift on my desk mat.",artstream,1632
00:00:00,,And I don't want that.,artstream,1633
00:00:00,,"I would have a press pass for Friday for the Gamescom, but no accommodation.",artstream,1634
00:00:00,,I think I just don't have enough for the master's.,artstream,1635
00:00:00,,I understand.,artstream,1636
00:00:00,,It's the same for me.,artstream,1637
00:00:00,,That's why I would rather do it spontaneously with the Gamescom.,artstream,1638
00:00:00,,I'm going to work really hard on the master's next week.,artstream,1639
00:00:00,,"Because I know that if I really get into it, I can do a lot in a very short time.",artstream,1640
00:00:00,,"But yes, I'm procrastinating too hard.",artstream,1641
00:00:00,,I'm only there on Saturday and Sunday.,artstream,1642
00:00:00,,I'm only there on Friday and Sunday.,artstream,1643
00:00:00,,"Yes, I wanted to talk about the master's, but I can only do that next week when I really get into it.",artstream,1644
00:00:00,,And have a little more overview.,artstream,1645
00:00:00,,I think I need a little opinion.,artstream,1646
00:00:00,,I have to look at what I've written so far and read through it again.,artstream,1647
00:00:00,,"Because somehow, I don't know.",artstream,1648
00:00:00,,I'm going to look at what I have to give up.,artstream,1649
00:00:00,,"No, no.",artstream,1650
00:00:00,,"Thank you, Tom.",artstream,1651
00:00:00,,"T3, just.",artstream,1652
00:00:00,,Thank you very much for all the subs that come in.,artstream,1653
00:00:00,,You are cute.,artstream,1654
00:00:00,,You are absolutely cute.,artstream,1655
00:00:00,,I'm out for today.,artstream,1656
00:00:00,,"All right, I'm not there for that long either.",artstream,1657
00:00:00,,I started earlier to stop earlier.,artstream,1658
00:00:00,,How do I want to play something together?,artstream,1659
00:00:00,,I'll just message you.,artstream,1660
00:00:00,,"Yes, I'm still thinking about whether I should do a study or a survey.",artstream,1661
00:00:00,,Maybe you have good input on what you think is better.,artstream,1662
00:00:00,,"And generally, I can imagine that you have good input on what the subject is.",artstream,1663
00:00:00,,"If I wouldn't talk so stupidly and write even worse, then it would be okay.",artstream,1664
00:00:00,,"Yes, I'm trying to make a chatbot of myself.",artstream,1665
00:00:00,,And use these Twitch VODs where I also go into the messages and so on.,artstream,1666
00:00:00,,So that he learns a little how I express myself.,artstream,1667
00:00:00,,"Then prompting, hardcoding with certain rules.",artstream,1668
00:00:00,,And then I either want to do a study where people use it.,artstream,1669
00:00:00,,But then I have to think about which questions I ask that it is not too subjective at the end.,artstream,1670
00:00:00,,So from me it is subjective.,artstream,1671
00:00:00,,I just have to formulate objective questions and that's a bit of a problem.,artstream,1672
00:00:00,,Or whether I generally ask how people feel about it in different generations.,artstream,1673
00:00:00,,I can go into the subject and say I'm asking people who actually know me.,artstream,1674
00:00:00,,And who then make their impression.,artstream,1675
00:00:00,,"Yes, exactly.",artstream,1676
00:00:00,,"Yes, right.",artstream,1677
00:00:00,,I just have to look.,artstream,1678
00:00:00,,I would like to have different grades of people who know me.,artstream,1679
00:00:00,,I know myself here people.,artstream,1680
00:00:00,,"You can now, for example, about Twitch.",artstream,1681
00:00:00,,How I express myself on Twitch and so on.,artstream,1682
00:00:00,,And the chatbot will be very interesting.,artstream,1683
00:00:00,,But my mother knows me differently.,artstream,1684
00:00:00,,Sophia knows me differently.,artstream,1685
00:00:00,,Tom knows me differently than my partner.,artstream,1686
00:00:00,,There are different levels of relationships.,artstream,1687
00:00:00,,And then you can still get good input from people how they feel.,artstream,1688
00:00:00,,Whether it is too shallow for them.,artstream,1689
00:00:00,,Whether it suits them.,artstream,1690
00:00:00,,Whether they are surprised how well he can depict me.,artstream,1691
00:00:00,,Because they are very good at it.,artstream,1692
00:00:00,,And then I can also say that I am very good at it.,artstream,1693
00:00:00,,I can also say that I am very good at it.,artstream,1694
00:00:00,,I can also say that I am very good at it.,artstream,1695
00:00:00,,Whether it suits them.,artstream,1696
00:00:00,,Whether they are surprised how well he can depict me.,artstream,1697
00:00:00,,Because they may not know me so well.,artstream,1698
00:00:00,,And how they might approach me beforehand.,artstream,1699
00:00:00,,And how they might approach me beforehand.,artstream,1700
00:00:00,,That's just difficult.,artstream,1701
00:00:00,,"Yes, exactly.",artstream,1702
00:00:00,,"Yes, I just have to look.",artstream,1703
00:00:00,,It's just good to know.,artstream,1704
00:00:00,,"It's just like my partner, my family, my best friends.",artstream,1705
00:00:00,,"It's just like my partner, my family, my best friends.",artstream,1706
00:00:00,,It's private to know.,artstream,1707
00:00:00,,While Twitch is just social media.,artstream,1708
00:00:00,,I am waiting for the first Looneybot date.,artstream,1709
00:00:00,,I will admit that he must not be romantically engaged.,artstream,1710
00:00:00,,I will admit that he must not be romantically engaged.,artstream,1711
00:00:00,,I will admit that he must not be romantically engaged.,artstream,1712
00:00:00,,Let's not do that.,artstream,1713
00:00:00,,And no image generation here.,artstream,1714
00:00:00,,And no image generation here.,artstream,1715
00:00:00,,My voice was already stolen to call my mother that I had a car accident.,artstream,1716
00:00:00,,My voice was already stolen to call my mother that I had a car accident.,artstream,1717
00:00:00,,"She called me while I was sitting at the table and my passport, the documents, just went through my hand.",artstream,1718
00:00:00,,"And my passport, the documents, just went through my hand.",artstream,1719
00:00:00,,The lady who gave me the documents to sign.,artstream,1720
00:00:00,,I was sitting in the office.,artstream,1721
00:00:00,,"She wrote to me, yes, you had such an accident.",artstream,1722
00:00:00,,"I was like, no, I'm sitting in the citizen's office.",artstream,1723
00:00:00,,"I was like, no, I'm sitting in the citizen's office.",artstream,1724
00:00:00,,What's going on?,artstream,1725
00:00:00,,As if I would call you a misprinted number.,artstream,1726
00:00:00,,As if I would call you a misprinted number.,artstream,1727
00:00:00,,"And then my mother said, And then my mother said, She was not sure, because she was already trusting me that I would overtake a pregnant woman.",artstream,1728
00:00:00,,And that she would die.,artstream,1729
00:00:00,,Because I was driving over a red light.,artstream,1730
00:00:00,,And I wouldn't have it with 5 kmh.,artstream,1731
00:00:00,,And I wouldn't have it with 5 kmh.,artstream,1732
00:00:00,,I would have been driving over the light at 50 kmh.,artstream,1733
00:00:00,,"My last car accident was on the highway, in a traffic jam, at 10 kmh, because I pulled out, because I thought, a truck pulled out too, right behind me, and I thought, if a truck has space, I have space too.",artstream,1734
00:00:00,,"Stupid logic, I know, stupid logic.",artstream,1735
00:00:00,,"The truck could still brake, it saw more.",artstream,1736
00:00:00,,I just didn't.,artstream,1737
00:00:00,,"Then we are together, I at a brand new BMW with fucking 10 kmh.",artstream,1738
00:00:00,,I drove this BMW on the dirt that was on the front of my car.,artstream,1739
00:00:00,,There was not even a scratch.,artstream,1740
00:00:00,,That was literally just dirt that I drove on it.,artstream,1741
00:00:00,,That was just nothing.,artstream,1742
00:00:00,,That was my last car accident.,artstream,1743
00:00:00,,"My first car accident, I only had two.",artstream,1744
00:00:00,,My other car accident was that I was standing on the mountain and was rolling back very slowly.,artstream,1745
00:00:00,,That was such a mountain.,artstream,1746
00:00:00,,I didn't roll back quickly.,artstream,1747
00:00:00,,Then I docked to the car with my trailer clutch.,artstream,1748
00:00:00,,"It didn't hurt, nothing.",artstream,1749
00:00:00,,But I got a warning because of the air traffic.,artstream,1750
00:00:00,,Did she say something good today?,artstream,1751
00:00:00,,I...,artstream,1752
00:00:00,,I don't know.,artstream,1753
00:00:00,,She definitely said that she also had a shield under function.,artstream,1754
00:00:00,,And at the beginning she was super smart.,artstream,1755
00:00:00,,At the beginning she had to take very strong pills.,artstream,1756
00:00:00,,Because it was really bad for her.,artstream,1757
00:00:00,,And she found out that she had 15.,artstream,1758
00:00:00,,"And the thing is, I was in the hospital once because of a kidney colleague.",artstream,1759
00:00:00,,And then I was told that maybe she had a shield under function.,artstream,1760
00:00:00,,"I was like, no, I don't think so.",artstream,1761
00:00:00,,I'm also very under important.,artstream,1762
00:00:00,,I don't know what to say.,artstream,1763
00:00:00,,But my blood values were already there.,artstream,1764
00:00:00,,That the nurse said that I had a shield under function.,artstream,1765
00:00:00,,And I didn't take it seriously.,artstream,1766
00:00:00,,But I didn't have many symptoms.,artstream,1767
00:00:00,,That's why I guess it's not always a challenge for me.,artstream,1768
00:00:00,,I actually have a shield under function and it's getting worse because she's not treated.,artstream,1769
00:00:00,,Loony's mom saying something nice challenge.,artstream,1770
00:00:00,,"Yeah, we'll invite her to a livestream and then we'll wait until she says something nice.",artstream,1771
00:00:00,,It's not gonna happen.,artstream,1772
00:00:00,,More hitting.,artstream,1773
00:00:00,,What do you mean?,artstream,1774
00:00:00,,What parking picture do you have to think of?,artstream,1775
00:00:00,,"Why do you dare to do that to me, Bush?",artstream,1776
00:00:00,,To drive over a red traffic light?,artstream,1777
00:00:00,,"I'm not under important, kid.",artstream,1778
00:00:00,,I have a normal weight.,artstream,1779
00:00:00,,It's okay.,artstream,1780
00:00:00,,Where you parked so tight.,artstream,1781
00:00:00,,That wasn't me!,artstream,1782
00:00:00,,"I parked, went in, paid, came out and some kind of stupid guy drove against my car while parking and was standing next to my car.",artstream,1783
00:00:00,,He was docked and then just got out and pissed himself off.,artstream,1784
00:00:00,,That wasn't me!,artstream,1785
00:00:00,,I parked and there was nobody in front of me.,artstream,1786
00:00:00,,It wasn't me!,artstream,1787
00:00:00,,That was also a...,artstream,1788
00:00:00,,I don't know what I'm gonna do now.,artstream,1789
00:00:00,,I'm gonna wait for the guy.,artstream,1790
00:00:00,,He can have a huge shopping and can only come in two hours.,artstream,1791
00:00:00,,Yeah.,artstream,1792
00:00:00,,It really wasn't me.,artstream,1793
00:00:00,,People told me I think he drove against your car when I came back.,artstream,1794
00:00:00,,"I was like, bro, what?",artstream,1795
00:00:00,,I went into the shopping district and bought two things.,artstream,1796
00:00:00,,"I wasn't in the shopping district, I was in the shop.",artstream,1797
00:00:00,,Shopping district!,artstream,1798
00:00:00,,I was in there for five minutes.,artstream,1799
00:00:00,,Pump.,artstream,1800
00:00:00,,Pump.,artstream,1801
00:00:00,,What a jerk.,artstream,1802
00:00:00,,A lack of ice because the pill was forgotten and the red traffic light is green.,artstream,1803
00:00:00,,No.,artstream,1804
00:00:00,,No.,artstream,1805
00:00:00,,So that I overtake people on purpose.,artstream,1806
00:00:00,,No.,artstream,1807
00:00:00,,Not really.,artstream,1808
00:00:00,,Or I don't know because I have to avoid another car or something.,artstream,1809
00:00:00,,But normally when I build accidents they're just really stupid.,artstream,1810
00:00:00,,Really stupid with 5 km per hour.,artstream,1811
00:00:00,,Like the best friend of my cousin who drove a scooter at 10 km per hour.,artstream,1812
00:00:00,,And then he drove so slowly that the scooter just flipped over.,artstream,1813
00:00:00,,He lay down on the wall and just broke himself in the elbow.,artstream,1814
00:00:00,,"No, no, she didn't say she was afraid of me, but that I overtake people.",artstream,1815
00:00:00,,Sometimes you're also completely through each other and then you just drive over a red traffic light.,artstream,1816
00:00:00,,"I was like, bro.",artstream,1817
00:00:00,,When did you notice that I drove over a red traffic light?,artstream,1818
00:00:00,,"You never drove with me, lady.",artstream,1819
00:00:00,,I've never been blinded by a red traffic light or something.,artstream,1820
00:00:00,,I was blinded the last time seven years ago.,artstream,1821
00:00:00,,Well.,artstream,1822
00:00:00,,My mom.,artstream,1823
00:00:00,,"Yes, yes.",artstream,1824
00:00:00,,"So now there's an ad, right?",artstream,1825
00:00:00,,Shit.,artstream,1826
00:00:00,,But I would talk to you somewhere else now.,artstream,1827
00:00:00,,But I don't know where to go.,artstream,1828
00:00:00,,Do you have any suggestions?,artstream,1829
00:00:00,,"Something like that is an accident, yes.",artstream,1830
00:00:00,,"Yes, sure.",artstream,1831
00:00:00,,Create our own game.,artstream,1832
00:00:00,,Santos streams.,artstream,1833
00:00:00,,But Santos streams currently some stupid shit games.,artstream,1834
00:00:00,,Elden Ring.,artstream,1835
00:00:00,,What?,artstream,1836
00:00:00,,Haro?,artstream,1837
00:00:00,,Yes.,artstream,1838
00:00:00,,"Yes, why not?",artstream,1839
00:00:00,,Elden Ring is always good.,artstream,1840
00:00:00,,First playthrough with Seamless Co-op.,artstream,1841
00:00:00,,That's crazy.,artstream,1842
00:00:00,,Sender is always good.,artstream,1843
00:00:00,,I'm not sure.,artstream,1844
00:00:00,,I'm not sure.,artstream,1845
00:00:00,,So.,artstream,1846
00:00:00,,Yes.,artstream,1847
00:00:00,,Thanks for the stream.,artstream,1848
00:00:00,,It was a lot of fun.,artstream,1849
00:00:00,,We'd love to do it again.,artstream,1850
00:00:00,,Congratulations to Kai again.,artstream,1851
00:00:00,,I'll give you the picture tomorrow.,artstream,1852
00:00:00,,Or the day after tomorrow or something.,artstream,1853
00:00:00,,"Many, many thanks for the gifted subs.",artstream,1854
00:00:00,,"Inferno, Bush and Sandim.",artstream,1855
00:00:00,,"Thanks for the raid, Sandim.",artstream,1856
00:00:00,,You missed it.,artstream,1857
00:00:00,,Hello Flo.,artstream,1858
00:00:00,,I can show you shortly.,artstream,1859
00:00:00,,I can show you shortly.,artstream,1860
00:00:00,,"It's not my best work, but it's honest work.",artstream,1861
00:00:00,,Kai won.,artstream,1862
00:00:00,,Yes.,artstream,1863
00:00:00,,So we're going to the Elden Ring stream.,artstream,1864
00:00:00,,Thanks for all the reserves.,artstream,1865
00:00:00,,Thanks for the support.,artstream,1866
00:00:00,,Thanks for so many people being there today.,artstream,1867
00:00:00,,Even though it's a fucking Thursday.,artstream,1868
00:00:00,,It's very good.,artstream,1869
00:00:00,,I also got my upper part.,artstream,1870
00:00:00,,I think so.,artstream,1871
00:00:00,,The perspective is a bit weird.,artstream,1872
00:00:00,,But it's okay.,artstream,1873
00:00:00,,Sunday there's no stream because I have guests.,artstream,1874
00:00:00,,"Next week, then next week again because I have a holiday.",artstream,1875
00:00:00,,Okay.,artstream,1876
